{
  "specversion": "1.0",
  "id": "01J8ZP9B1R2D3G4E5A6C7T8N9K",
  "source": "urn:loyaltyhub:source:internal",
  "type": "io.loyaltyhub.action.reward.redeemed",
  "subject": "member:MBR-000004",
  "time": "2026-09-15T09:30:02Z",
  "datacontenttype": "application/json",
  "dataschema": "urn:loyaltyhub:schema:action.reward.redeemed:1",
  "lhtenant": "aurora",
  "lhcorrelationid": "01J8ZP0A1B2C3D4E5F6G7H8J9K",
  "lhcausationid": "01J8ZP3C4F5M6D7Q8R9S0T1V2W",
  "lhhop": 1,
  "lhactor": "MEMBER:MBR-000004",
  "data": {
    "redemptionId": "01J8ZP1R2E3D4M5P6T7N8V9W0X",
    "rewardCode": "RWD-SHOP-10",
    "rewardName": "Buono shopping 10 €",
    "pointsCost": 1500
  }
}
