{
  "specversion": "1.0",
  "id": "01J8ZP0A1B2C3D4E5F6G7H8J9K",
  "source": "urn:loyaltyhub:service:reward",
  "type": "io.loyaltyhub.fact.reward.redemption.requested",
  "subject": "member:MBR-000004",
  "time": "2026-09-15T09:30:02Z",
  "datacontenttype": "application/json",
  "dataschema": "urn:loyaltyhub:schema:fact.reward.redemption.requested:1",
  "lhtenant": "aurora",
  "lhcorrelationid": "01J8ZP0A1B2C3D4E5F6G7H8J9K",
  "lhhop": 0,
  "lhactor": "MEMBER:MBR-000004",
  "data": {
    "redemptionId": "01J8ZP1R2E3D4M5P6T7N8V9W0X",
    "rewardCode": "RWD-SHOP-10",
    "rewardName": "Buono shopping 10 €",
    "currency": "PTS",
    "pointsCost": 1500
  }
}
