{
  "specversion": "1.0",
  "id": "01J8ZR2A3B4C5D6E7F8G9H0J1K",
  "source": "urn:loyaltyhub:source:internal",
  "type": "io.loyaltyhub.action.referral.completed",
  "subject": "member:MBR-000002",
  "time": "2026-09-24T10:15:01Z",
  "datacontenttype": "application/json",
  "dataschema": "urn:loyaltyhub:schema:action.referral.completed:1",
  "lhtenant": "aurora",
  "lhcorrelationid": "01J8ZR0A1B2C3D4E5F6G7H8J9K",
  "lhcausationid": "01J8ZR1A2B3C4D5E6F7G8H9J0K",
  "lhhop": 1,
  "data": {
    "role": "REFERRER",
    "counterpartMemberId": "MBR-000009",
    "qualifyingActionId": "01J8ZR0A1B2C3D4E5F6G7H8J9K"
  }
}
