{
  "specversion": "1.0",
  "id": "01J8ZP7Q2M9T4B6N8R0XWYRELE",
  "source": "urn:loyaltyhub:service:wallet",
  "type": "io.loyaltyhub.fact.wallet.points.released",
  "subject": "member:MBR-000003",
  "time": "2026-09-21T02:00:00Z",
  "datacontenttype": "application/json",
  "dataschema": "urn:loyaltyhub:schema:fact.wallet.points.released:1",
  "lhtenant": "aurora",
  "lhcorrelationid": "01J8ZP7Q2M9T4B6N8R0XWYRELE",
  "lhhop": 0,
  "data": {
    "ledgerEntryId": "01J8ZP7Q3Z2M9T4B6N8R0XWYRE",
    "lotId": "01J8ZP7Q3Y2M9T4B6N8R0XWYRE",
    "currency": "PTS",
    "amount": 200,
    "balanceAfter": 2212
  }
}
