{
  "specversion": "1.0",
  "id": "01J8ZT10A1B2C3D4E5F6G7H8J9",
  "source": "urn:loyaltyhub:source:internal",
  "type": "io.loyaltyhub.action.member.birthday",
  "subject": "member:MBR-000002",
  "time": "2026-09-24T10:15:00Z",
  "datacontenttype": "application/json",
  "dataschema": "urn:loyaltyhub:schema:action.member.birthday:1",
  "lhtenant": "aurora",
  "lhcorrelationid": "01J8ZT0A1B2C3D4E5F6G7H8J9K",
  "lhcausationid": "01J8ZT9A1B2C3D4E5F6G7H8J9K",
  "lhhop": 1,
  "data": {
    "age": 34
  }
}
