{
  "specversion": "1.0",
  "id": "01J8ZT7Q2M9T4B6N8R0XWYTIDO",
  "source": "urn:loyaltyhub:service:wallet",
  "type": "io.loyaltyhub.fact.tier.downgraded",
  "subject": "member:MBR-000003",
  "time": "2026-12-31T23:59:59Z",
  "datacontenttype": "application/json",
  "dataschema": "urn:loyaltyhub:schema:fact.tier.downgraded:1",
  "lhtenant": "aurora",
  "lhcorrelationid": "01J8ZT7Q2M9T4B6N8R0XWYTIEA",
  "lhcausationid": "01J8ZT7Q1M9T4B6N8R0XWYTIEA",
  "lhhop": 0,
  "data": {
    "previousTier": "GOLD",
    "newTier": "SILVER",
    "editionCode": "ED-2026"
  }
}
