{
  "specversion": "1.0",
  "id": "01J8ZP3A4B5C6D7E8F9G0H1J2K",
  "source": "urn:loyaltyhub:service:gamification",
  "type": "io.loyaltyhub.fact.contest.played",
  "subject": "member:MBR-000011",
  "time": "2026-09-24T10:15:00Z",
  "datacontenttype": "application/json",
  "dataschema": "urn:loyaltyhub:schema:fact.contest.played:1",
  "lhtenant": "aurora",
  "lhcorrelationid": "01J8ZP0A1B2C3D4E5F6G7H8J9K",
  "lhhop": 0,
  "lhactor": "member:MBR-000011",
  "data": {
    "contestCode": "IW-AUTUNNO",
    "playId": "01J8ZP3A4B5C6D7E8F9G0H1J2K",
    "outcome": "WIN",
    "kind": "FREE_DAILY",
    "playsAvailable": 2
  }
}
